original_text,document,paragraph_index,simplified_text
"Va ancora evidenziata l'impossibilità – in assenza di un processo di ristrutturazione patrimoniale – di garantire l'equilibrio economico-finanziario e di fronteggiare la propria esposizione debitoria, ritenuta dagli organi di amministrazione e controllo della partecipata, indispensabile al superamento della crisi e a garantire la continuità aziendale.",07108e7d68b7e897ed6a800be9802105,23,"Si nota che non è possibile fare un programma ristrutturato patrimoniale, ma si possono recuperare anche i debiti, rispettando le autorità e le organizzazioni che si occupano della società, per proteggere la sua situazione e garantire la continuità delle attività in azienda."
"Si evidenzia che nel 2019 la società, dopo anni di perdite, ha realizzato un risultato positivo di euro 2.964,00, in linea con il Piano Industriale 2019 – 2023 sottoposto alla valutazione degli Azionisti in occasione dell'Assemblea Straordinaria del 21 gennaio 2019. Sul punto, tra l'altro si rileva che la ""Audirevi"" nella propria relazione sul bilancio 2019 ha preso atto del fatto che ""la società Lamezia Europa SpA ha messo in atto una serie di attività ed interventi, di seguito indicati, che potranno permettere, a partire dall'esercizio di bilancio 2020, di recuperare l'equilibrio finanziario societario, allo stato compromesso, e garantire la continuità aziendale"".",07108e7d68b7e897ed6a800be9802105,24,"Nel 2019 l'azienda ha avuto un guadagno di 2.964,00 euro, che riguarda l'investimento di euro 2.964,00 nel Piano Industriale 2019 – 2023 ottenuto dagli Azionisti durante l'Assemblea Straordinaria del 21 gennaio 2019. Per questo motivo, la società Lamezia Europa SpA sta raggiungendo delle attività e dei lavori principali che potranno garantire che la società, a partire dalla crisi del 2020, siano compromessi insieme e garantire la continuità aziendale."
"Al riguardo la ""Audirevi"" ha richiamato l'attenzione sul seguente aspetto commentato dagli amministratori nella Relazione sulla Gestione ""Lo squilibrio economico-finanziario che ne è rivenuto è, comunque, legato a più fattori:",07108e7d68b7e897ed6a800be9802105,25,L'Azienda Autonoma ha chiesto ai suoi amministratori di capire cosa sia più importante ha detto.
"in primis, un risultato fortemente legato alla crisi pandemica che nel 2020 ha investito il nostro Paese ed ha determinato e continuerà a determinare anche per il 2021 conseguenze e ricadute molto negative sull'economia nazionale;",07108e7d68b7e897ed6a800be9802105,26,"Ogni anno, il risultato fornito alla crisi pandemica nel 2020 ha avuto il nostro Paese ed ha avuto un'effetto più positivo della situazione in nostra regione perché continuerà a determinare delle cose negativhe e negative sull'economia nazionale."
"il residuo debito di €. 2,4 milioni verso Ubi Banca per il mutuo fondiario stipulato a dicembre 2005 occorre che venga rimodulato e ulteriori privilegiati riguardano l'Erario, per i quali sono, anche, in corso delle rateazioni.",07108e7d68b7e897ed6a800be9802105,27,"Il debito di 2,4 milioni viene redotto a Ubi Banca a dicembre 2005 per il mutuo temporaneo stipulato a dicembre 2005 e altri risultati riguardano la società Erario, che sta chiudendo le rateazioni."
"Si aggiunge il ritardo, a causa della pandemia, si è detto, nei percorsi di maturazione, nei tempi previsti, dei principali progetti portati avanti dalla società (Green Economy, Waterfront e Porto Turistico, Progetto centro servizi, Progetto AgriExpo).",07108e7d68b7e897ed6a800be9802105,28,"Si è anche stabilito che i principali progetti presentati dall'azienda sono stati ottenuti nei percorsi previsti dalla pandemia in base alla situazione della pandemia, come nel periodo previsto."
"In considerazione di quanto rappresentato, gli amministratori, nella consapevolezza di aver descritto adeguatamente gli eventi e le circostanze principali che possono far sorgere dubbi sulla capacità dell'azienda di continuare ad operare come un'entità in funzionamento, nonché i piani ad oggi ancora non verificatisi per far fronte a tali eventi e circostanze, hanno ritenuto di seguitare ad adottare il presupposto della continuità aziendale nell'elaborazione del presente bilancio in relazione all'attesa capacità dell'impresa di continuare ad operare come un'entità in funzionamento entro i 12 mesi successivi alla data di riferimento del bilancio tenuto conto in particolare:",07108e7d68b7e897ed6a800be9802105,29,"Per quanto dichiarato, gli amministratori hanno deciso di aver esaminato e spiegato i cambiamenti e le situazioni importanti che possono far sorvegliare i loro eventi e le situazioni principali che possono far influenzare la capacità dell'azienda di continuare a operare come un entità in funzionamento. I piani ancora non controllati per rivedere l'attesa capacità dell'azienda di continuare a operare come un'ente in funzionamento entro 9 mesi dopo la data della ricezione del bilancio, perché il bilancio è stato conto dell'importanza del bilancio del bilancio, inclusi altri:"
"Dell'attuazione del progetto legato alla green economy della società anglo-tedesca Aura Power, che prevede un investimento complessivo di 15 milioni di euro, e che potrà determinare, tra ottobre e novembre 2021, la vendita di un macrolotto di 20 ettari circa con un introito cash all'atto del rogito notarile per la società di circa 2.400.000,00 euro. Come già evidenziato in precedenza il progetto, a seguito della presentazione ad aprile 2021 della documentazione tecnica, è attualmente in fase di istruttoria da parte del Dipartimento Ambiente della Regione Calabria attraverso la procedura del PAUR ""Provvedimento Autorizzatorio Unico Regionale"" che sarà conclusa entro 120 giorni dalla presentazione di tutta la documentazione prevista. Considerato che il lotto in cui insiste il progetto è già destinato a livello urbanistico alla realizzazione di impianti per la produzione di energia da fonti rinnovabili, il nullaosta tecnico per l'immissione in rete attraverso una linea già esistente nell'area da parte di Enel e che la potenza dei due impianti previsti non supera i 15 megawatt, il Consiglio di Amministrazione ritiene che non ci sono elementi ostativi all'attuazione del progetto.",07108e7d68b7e897ed6a800be9802105,30,"Il progetto che ha investito 15 milioni di euro, che sta aumentando del valore di 15 milioni di euro. Si prevede di comprare 20 ettari di 20 ettari circa a quanto stabilito negli ultimi 120 giorni dalla vendita. Questo progetto è in fase di istruttoria dal Dipartimento Ambiente della Regione Calabria attraverso un PAUR ""Provvedimento Autorizzatorio Unico Regionale"" che verrà gara entro 120 giorni dalla presentazione di tutte le informazioni tecnica. Per essere fatto, dal novembre 2021, il progetto ha iniziato ad accreditare il Dipartimento Ambiente della Regione Calabria per migliorare la trattamento delle fonti di fonti da fonti rinnovabili, il nullaosta tecnico, il nullaosta tecnico per utilizzare un linea giàesistente in rete tramite una linea già esistente, che la potenza dei due impianti previsti non supera i 15 milioni di energia, è la guida del Consiglio di Amministrazione che non fa parte delle informazioni sull'attuazione del contratto."
"Dell'attuazione del progetto waterfront e Porto Turistico promosso da Coipa International che, definita la procedura di evidenza pubblica, determinerà la concretizzazione degli impegni finanziari a favore della società contenuti nel MOI rivisto e sottoscritto nel dicembre 2020. In particolare si evidenzia che in data 5 maggio 2021 Coipa International, in una nota trasmessa alla società, ha confermato l'impegno a sottoscrivere, attraverso la NEWCO Coipa Italia Spa in fase di costituzione, azioni della Lameziaeuropa spa fino ad un controvalore pari a 1.500.000,00 euro.",07108e7d68b7e897ed6a800be9802105,31,"Il progetto waterfront e Porto Turistico promosso da Coipa International, che è un documento che riguarda la procedura pubblica, è stato completato del nostro progetto. La società ha confermato che il 5 maggio 2021 Coipa International ha confermato l'impegno di firmare azioni della Lameziaeuropa spa fino a 1.500.000,00 euro, mentre la Lameziaeuropa spa si è stata scesi."
"Della prosecuzione delle attività di vendita dei lotti della società, i cui preliminari sono già stati stipulati nel corso del 2020 e che avranno attuazione nel 2021. In particolare nei primi quattro mesi del 2021 si è proceduto nell'area ex Sir con la stipula del rogito (26.02.2021) con la società Dinamica srl valore operazione 45.000 euro oltre iva e nell'area Pip Rotoli con la stipula del rogito (10.02.2021) con Giancarlo Pulice valore operazione 44.000 euro oltre iva. Inoltre entro il 15 giugno 2021 si procederà con la stipula di ulteriori due rogiti per lotti nell'area ex Sir rispettivamente con la società Pironaggi valore operazione 50.000 euro oltre iva e con la società Costa Group valore operazione 55.000 euro oltre iva e di un ulteriore lotto nell'area Pip Rotoli con la società Vimer Sud valore operazione 66.000 euro oltre iva.",07108e7d68b7e897ed6a800be9802105,32,"I due dipendenti della società sono già stati annunciati entro il 2020 e abbiamo iniziato nel 2021. La società sta portando 50.000 euro e 44.000 euro IVA e stanno lavorando nel 2021. Nel 2021, entro il 15 giugno 2021 verrà stipulato due modi di comprare i lotti nell'area ex Sir, con 50.000 euro e IVA e in una società Costa Group di 55.000 euro anziché IVA e di un settore in zona Pip Rotoli con la società Vimer Sud a 66.000 euro iva."
"Le esistenti concrete avviate operazioni di ingressi di finanza hanno condotto a tracciare un percorso di sicura realizzabilità. Si ritiene, pertanto, che sussista la ragionevole aspettativa acché la Società, entro il 31 dicembre 2021, possa disporre di adeguate risorse finanziarie atte a pervenire alla chiusura del mutuo in essere con IntesaSanpaolo già Ubibanca, al ripianamento delle passività pregresse ed all'esercizio delle correnti attività gestionali, volte, con determinazione, al perseguimento di tutti gli obbiettivi programmati"".",07108e7d68b7e897ed6a800be9802105,33,"Le operazioni di pagamento da fare hanno avuto un percorso sicuro perché la società può fornire informazioni facili per iniziare a essere resiliente. La Società ha una certa situazione, riguardo a chiudere il mutuo con IntesaSanpaolo già Ubibanca, ripianare le passività pregerne e gestire le attività gestionali, determinate da considerare che si possa raggiungere tutti gli obiettivi stabiliti."
"Nel corso dell'esercizio chiuso al 31 dicembre 2021 la società ha subito una perdita di Euro 191.199; tale risultato economico negativo ha ridotto il Patrimonio a 2,2 milioni di euro rispetto ai 2,4 milioni di Euro dell'esercizio precedente.",07108e7d68b7e897ed6a800be9802105,34,"Nel 2021, la società ha perdito 175.199 euro per un valore di 193.199 euro. Questo risultato ha cambiato il Patrimonio a 2,2 milioni di euro fino ai 2,4 milioni di euro in passato."
"L'Amministrazione Provinciale, nonostante le criticità sopra evidenziate crede fermamente nelle potenzialità della partecipata di continuare ad operare nella qualità di ""Agenzia di Sviluppo Locale"" contribuendo, nel rispetto delle previsioni di cui all'art. 4 comma 2, del d. lgs. 175/2016, alla produzione di un servizio di interesse generale, oltre che al perseguimento delle finalità istituzionali dell'Ente individuate nella promozione e nella tutela dello sviluppo e del progresso civile, sociale ed economico della propria comunità. La detenzione della partecipazione non appare contrastante con le previsioni di cui all'art. 5, comma 1, del medesimo decreto in quanto il mercato locale fa constatare l'esclusività della società rispetto a potenziali concorrenti, data l'assenza di altre compagini similari e partecipate che svolgono le medesime funzioni in ambito comunale, comprensoriale e sovra comunale ovvero in ambiti territoriali ottimali.",07108e7d68b7e897ed6a800be9802105,35,"L'Amministrazione Provinciale si impegna a continuare a fare lavori per migliorare la qualità di ""Agenzia di Sviluppo Locale"" tenendo conto di quanto sia importante, nel rispetto delle regole stabilite dall'articolo 4 comma 2, del decreto legislativo 175/2016. Negli ultimi aspetti, si limita a produzione di un servizio di interesse generale e a migliorare lo sviluppo e lo progresso sociale della propria comunità. La partecipazione non è presa contro le regole dell'articolo 5, comma 1, del decreto. Inoltre, il mercato locale fa notare che questa società non esiste rispetto a altre aziende simili e partecipate che si occupano di migliorare le funzioni in ambito comunale, comprensoriale e sovra-comunale, oppure in altri settori territoriali ottimali."
"Pertanto, l'Amministrazione Provinciale intende avvalersi della previsione di cui al TUSP, art. 26 rubricato ""Altre disposizioni transitorie"", comma 7 – che testualmente recita ""Sono fatte salve, fino al completamento dei relativi progetti, le partecipazioni pubbliche nelle società costituite per il coordinamento e l'attuazione dei patti territoriali e contratti d'area per lo sviluppo locale, ai sensi della delibera CIPE 21 marzo 1997"" – che consente di superare quanto previsto dall'art. 24, comma, d. lgs. n. 175/2016 che prevede l'alienazione delle partecipazioni che non soddisfano quanto previsto dall'articolo 20, comma 2, lett. b) e d) del decreto.",07108e7d68b7e897ed6a800be9802105,36,"L'Amministrazione Provinciale intende dire approvare una legge sul TUSP, comma 7 del TUSP, che riguarda le partecipazioni pubbliche nelle società che si occupano di coordinare e costruire i patti territoriali e i contratti per lo sviluppo locale, secondo la decisione del CIPE 21 marzo 1997"". Questo serve a superare i requisiti stabiliti dall'articolo 24, comma, d. lgs. n. 175/2016 che garantirà che le partecipazioni che non soddisfano le richieste del decreto."
"È una società per azioni a capitale misto a prevalenza pubblica che ha sede nel Comune di Lamezia Terme presso l'aeroporto civile. La società è stata costituita in data 23 febbraio 1990. È iscritta nel Registro Imprese di Catanzaro dal 7 giugno 1990 (codice fiscale e partita Iva 01764970792, n. R.E.A. CZ-134480). La società ha per oggetto lo sviluppo, progettazione, realizzazione, adeguamento, gestione, manutenzione ed uso degli impianti e delle infrastrutture concernenti l'esercizio dell'attività dello scalo dell'aeroporto di Lamezia Terme, o di eventuali altri scali e dei relativi servizi di assistenza a terra e commerciali, dei collegamenti con i centri urbani via aerea e via superficie nonché la realizzazione e la gestione intermodale dei trasporti.",07108e7d68b7e897ed6a800be9802105,37,"La società è una società che si trova nel Comune di Lamezia Terme nel Comune di Lamezia Terme. Ha creato il 23 febbraio 1990 per organizzazioni che si trovano negli aeroporti civili. Viene l'impresa holding con un codice fiscale e partita Iva 01764970792, n. R.E.A. CZ-134480 (codice fiscale. 01764970792, n. R.E.A. CZ-134480). La società si occupa di sviluppare, migliorare, gestire, mantenere e mantenere gli impianti e le infrastrutture che influenzano l'attività dell'aeroporto di Lamezia Terme o di altri aeroporti. Si occupa di sviluppare, progettare, manutenzione e manutenzione degli impianti e delle infrastrutture legate a la manutenzione dei trasporti a terra, commerciali e la gestione intermodale delle strade."
"In qualità di gestore aeroportuale, ""S.A.CAL. S.p.A."" – in forza di apposita convenzione quarantennale con l'Ente Nazionale per l'Aviazione Civile (E.N.A.C.), sottoscritta in data 11 settembre 2017 e resa efficace con D.I. n. 69 (Infrastrutture – Trasporti – Economia e Finanze), registrato alla Corte dei Conti in data 29/07/2009 – coordina e gestisce l'intero aeroporto, pianifica e coordina lo sviluppo infrastrutturale dello scalo, cura la manutenzione e la pulizia, gestisce i controlli di sicurezza sui passeggeri in partenza, le aree parcheggio e la fornitura di servizi commerciali e pubblicitari attraverso concessione a terzi.",07108e7d68b7e897ed6a800be9802105,38,"C'è un altro gestore aeroportuale dell'aeroporto chiamata ""S.A.CAL. S.p.A."", firmato e firmato il 11 settembre 2017 e in linea con un accordo con l'Ente Nazionale per l'Aviazione Civile (E.N.A.C., firmato il 11 settembre 2017 e il 30 luglio 2009. Inoltre, la compito dell'intero aeroporto è gestire e gestire l'impianto, costruire, mantenere e pulizia l' aeroporto, gestire regolarmente le strutture, proteggere e mantenere dei passeggeri fin dalla partenza, proteggere i parcheggio e fornire servizi commerciali e pubblicitari tramite concessione a altre persone."
"Nel corso dell'anno 2016, la società è stata oggetto di un aumento di capitale sociale. Prima di tale operazione, il 66.74% delle azioni era detenuto da Enti Pubblici e il rimanente 33,26% da investitori privati. Il capitale sociale ammontava ad € 7.755.000,00, interamente versato, suddiviso in 15.000 azioni del valore nominale di € 517,00. La Provincia di Catanzaro possedeva una partecipazione di n. di n. 2085 azioni, per un valore nominale di € 1.077.945,00, pari al 13.90% del Capitale Sociale.",07108e7d68b7e897ed6a800be9802105,39,"Nel 2016, la società è stata aumentata del capitale sociale. I 66.74% delle azioni erano causate da Enti Pubblici e il 33,26% di investitori privati. Il capitale sociale è di € 7.755.000,00, interamente versato, diviso in 15.000 azioni di € 517,00. La Provincia di Catanzaro possiede una partecipazione di 2085 azioni per un tasso di € 1.077.945,00, che è pari al 13.90% del Capitale Sociale."
"L'art. 3 del Decreto del Ministero dei Trasporti e della Navigazione n. 521 del 12 novembre 1997 – rubricato ""Capitale minimo delle società di gestione aeroportuale"", nel disporre che il capitale sociale dei gestori aeroportuali debba esser determinato in base alle unità di traffico globale calcolate su base annua – prescrive che esso non possa essere inferiore a ""lire 25.000 milioni"" (pari ad euro 12.911.423,00) per aeroporti con traffico da 2.000.001 ""WLU/anno"" a 5.000.000 ""WLU/anno"" deve intendersi ""Workload-units"" (unità di carico di lavoro) e l'unità equivale ad un passeggero. Il comma 2 del medesimo articolo stabilisce che ""L'obbligo di adeguamento del capitale delle società di gestione, in relazione alle varie classi indicate nel comma precedente, si determina sulla base della media del volume di traffico accertato nell'ultimo biennio"". La ""Relazione sulla gestione della S.A.CAL. S.p.A."" relativa all'anno 2014 – così come ribadito nella nota prot. n.11648/2015 del 20 novembre 2015, inviata agli azionisti della Società dal Presidente della società – evidenziava che ""S.A.CAL. S.p.A."" ha superato, nel biennio 2013/2014, i 2.000.001 ""Workload-units"". In considerazione di tale dato, la previsione di cui all'ultimo comma dell'art. 3 del Decreto del Ministero dei Trasporti e della Navigazione n. 521 del 12.11.1997, imponeva di procedere all'aumento di capitale sociale sino ad almeno € 12.911.423,00. La relazione sulla verifica amministrativo-contabile di ENAC e del MEF, notificata alla Società il 7 luglio 2014, ha rilevato il mancato adempimento da parte di ""S.A.CAL. S.p.A."" in ordine alla predetta prescrizione. La mancata ottemperanza a tale prescrizione avrebbe determinato il venir meno di un requisito oggettivo e la conseguente decadenza della concessione della gestione totale ai sensi dell'art. 14 bis della Convenzione ENAC/SACAL.",07108e7d68b7e897ed6a800be9802105,40,"L'articolo 3 del Decreto del Ministero dei Trasporti e della Navigazione n. 521 del 12 novembre 1997 è un gruppo che indica se i gestori aeroportuali devono essere adeguati siano stati aumentati. A seconda di questo criterio, il rischio di concentrarsi sul numero di traffico totale del traffico previsto dal 2014 era ""Worklog-units"" (per euro 12.9911.423,00). La relazione amministrativa e contabile dell'ente responsabile è confermata e la chiusura di questo gruppo non possiede meno ai rispetti dell'accordo di ENACS e del MEF degli azionisti, il 7 luglio 2014, ha rilevato che la società non abbiano ancora deciso di mantenere la prescrizione della prescrizione. La previsione dell'articolo 3 del Decreto del Ministero dei Trasporti e della Navigazione n. 52 del 12.11.1997 ha confermato che la società ha completato questo contratto in base al numero di persone con circolazione di circolazione di circolazione di circolazione di circolazione di circolazione di circolazione ogni anno. La relazione sulla gestione della società (S.A.CAL. S.p.A."" nell'anno 2013/2014 ha contestato le regole sulla gestione della società la prossima e lo richiede di pagare anche almeno 12.911.423,00 per i servizi di gestione del 2014."
"Pertanto, con deliberazione del Consiglio d'Amministrazione n. 9 del 24 novembre 2015 ""S.A.CAL S.p.A."" ha deliberato l'aumento del capitale sociale da € 7.755.000,00 ad € 12.911.558,00, ai sensi dell'art. 2439 C.C., a seguito della presa d'atto della necessità di adeguamento del capitale sociale al succitato disposto dell'art. 3 del Decreto del Ministero dei Trasporti e della Navigazione n. 521 del 12 novembre 1997. Il valore nominale di ogni singola azione rimaneva immutato e pari ad € 517,00. Con deliberazione di Consiglio Provinciale n. 24 del 30 marzo 2015 – con la quale veniva approvato il Piano di razionalizzazione delle società partecipate e la relativa relazione tecnica, ai sensi della legge n. 190/2014 – si dava atto che: ""... la congiuntura economica mondiale ha avuto riflessi anche nel comparto aereo ma l'attuale management evidenzia che il bilancio 2014 registra un'inversione di tendenza rispetto alla gestione economica e finanziaria della società. La solidità di S.A.CAL. S.p.A. è certificata anche dalla concessione totale dello scalo attribuita alla suddetta società, nel 2009, da ENAV che reputa il gestore aeroportuale adeguato al mantenimento di standard di qualità efficienti e professionali"" Il medesimo piano prevedeva che: ""... la più importante struttura regionale allocata sul territorio comunale non vedrà la dismissione delle quote societarie della Provincia di Catanzaro che ritiene fondamentale continuare a essere parte di una società che già è punto di riferimento in tema di logistica e trasporti e che continua ad essere strategica per il tessuto sociale ed economico locale. L'analisi sullo stato di salute della società, sui risultati ottenuti, sul conseguimento di obiettivi gestionali e l'analisi finanziaria, anche in prospettiva della ricapitalizzazione, inducono la Provincia di Catanzaro alla riconferma della partecipazione azionaria in S.A.CAL. S.p.A."".",07108e7d68b7e897ed6a800be9802105,41,"Con la delibera del Consiglio d'Amministrazione n. 9 del 24 novembre 2015, ""S.A.CAL S.p.A."" ha deciso di aumentare il capitale sociale da 7.755.000,00 a 12.911.558,00, in base all'articolo 3 del Decreto del Ministero dei Trasporti e della Navigazione. Il bilancio 2014 stima che la Regione sta perdendo un grande profitto per la società di trasporto in modo efficiente e competitivo. Il bilancio significa che la Provincia di Catanzaro ne ha preso una decisione su come farli più importante per l'azienda, come gestire i mezzi connesse. Inoltre, ha preso alla decisione di risolvere il bilancio il 2014, con una decisione presa da EnAV come il gestore aeroportuale continua a mantenere una grande qualità ecologica e finanziare. Questa decisione prevedeva che: - La provincia di Catanzaro richiede di mantenere la partecipazione ai membri della società, che si occupa di mantenere standard di qualità efficienti e professionali."
"La Provincia di Catanzaro – dopo attente valutazioni e nel rispetto dei limiti imposti dalle norme vigenti – ha inteso, a causa delle scarse risorse finanziarie dovute ai continui tagli sulle finanze provinciali, non aderire all'aumento di capitale deliberato dal Consiglio d'Amministrazione della società ""S.A.CAL. S.p.A."" in data 24 novembre 2015, ai sensi dell'art. 2439 cc..",07108e7d68b7e897ed6a800be9802105,42,"La Provincia di Catanzaro ha deciso che per le risorse finanziarie in provincia di Catanzaro, a causa delle difficoltà finanziarie fatte nei tagli sulle finanze provinciali, non aderire a un'aumento legale deciso dal Consiglio d'Amministrazione della società ""S.A.CAL. S.p.A."" nel 24 novembre 2015, secondo l'articolo 2439 cc."
"A seguito delle determinazioni assunte dai Soci nel corso della assemblea straordinaria del 2 luglio 2021 la ""S.A.CAL S.p.A."" ha deliberato l'aumento del capitale sociale da € 12.911.558,00 ad € 23.920.556,00; per effetto di tale aumento ed in assenza di sottoscrizione di nuove azioni la partecipazione dell'amministrazione Provinciale di Catanzaro è scesa al 6,218% del capitale sociale.",07108e7d68b7e897ed6a800be9802105,43,"Dopo aver scelto i soci nel 2021, c'è stato un'idea per aumentare la quota del € 12.911.558,00 e 23.921.556,00 in base alle decisioni prese dai soci durante la nostra assemblea straordinaria del 2 luglio 2021 e senza essere firmate nuove azioni, il capitale sociale è sceso al 6,18% del capitale sociale."
