original_text,document,paragraph_index,simplified_text
"Prima della stipulazione del contratto, le imprese che si saranno presentate in Raggruppamento Temporaneo, Consorzio ordinario, aggregazioni di imprese di rete o GEIE da costituire dovranno costituire formalmente il Raggruppamento Temporaneo, il Consorzio ordinario, il raggruppamento di rete o il GEIE.",6d52bcc84ee3fa9bfec74bb009537bd2,101,"Prima di firmare il contratto, le imprese che si devono presentare insieme in un gruppo dei gruppi, il Consorzio ordinario o i laboratori, devono essere riorganizzate in società o geIE."
"In sede di verifica, per la comprova delle dichiarazioni rese in sede di gara, in merito alla capacità economico – finanziaria e alla capacità tecnico – organizzativa, i soggetti tenuti dovranno presentare: 
- per i requisiti di fatturato: copia dei bilanci d'esercizio o delle dichiarazioni IVA o, per i prestatori di servizi stabiliti in Stati membri che non prevedono la pubblicazione del bilancio, documentazione equipollente; 
- per l'elenco dei principali servizi: se trattasi di servizi e forniture prestati a favore di Amministrazioni o Enti pubblici, essi saranno provati da certificati rilasciati e vistati dalle Amministrazioni o dagli Enti medesimi; se trattasi di servizi e forniture prestati a privati, l'effettuazione della prestazione sarà dichiarata da questi, o in mancanza, dallo stesso concorrente; 
- i documenti attestanti l'iscrizione all'Albo dei Gestori Ambientali, istituito ai sensi dell'art. 212 del D.lgs.152/2006 e s. m. e i., per le categorie e classi di cui al DM 406/1998 dichiarate",6d52bcc84ee3fa9bfec74bb009537bd2,102,"Si può capire se le dichiarazioni saranno presentate perché è più aziendale economico e finanziaria che serve, e se gli operatori del territorio non prevedono la pubblicazione dei bilanci. Se si tratta di servizi offerti a terzi, verranno proveti dei certificati rilasciati o verificati dall'azienda. Se si tratta di servizi e forniture fornite a privati, verranno dichiarati dalla persona stessa dichiarata. Se si fa servizi e forniture a privati, verranno ottenuti certificati e ottenuti dallo stesso concorrente."
"Si rammenta che il concorrente, singolo o consorziato o raggruppato potrà soddisfare la richiesta relativa al possesso dei requisiti di carattere economico, finanziario, tecnico, organizzativo, avvalendosi dei requisiti di altro soggetto.",6d52bcc84ee3fa9bfec74bb009537bd2,103,"Si cercherà che un concorrente, un gruppo o una parte da un gruppo potrà richiedere di rispettare i requisiti economici, finanziari, tecnici e organizzativi, aiutando il concorrente."
"I requisiti di capacità tecnica e professionale riportati nel punto devono intendersi come requisiti ""soggettivi"" necessari per assicurare il corretto espletamento del servizio e titolo autorizzatorio al suo esercizio e, pertanto, non sono suscettibili di alcuna forma di sostituzione, né per essi è possibile ricorrere all'avvalimento;",6d52bcc84ee3fa9bfec74bb009537bd2,104,"I requisiti tecnici e professionali riportati nel punto devono essere considerati requisiti ""soggettivi"" necessari per garantire che il servizio e il titolo autorizzato il suo esercizio siano corretti, ma non è necessario un'alloggio e non riesci a chiedere i soldi che le persone possono svolgere."
"Il concorrente sarà vincolato alla propria offerta per centottanta giorni dalla scadenza del termine per la presentazione di cui all'art. 12, salvo proroghe richieste dalla stazione appaltante. ",6d52bcc84ee3fa9bfec74bb009537bd2,105,"Il concorrente verrà restituito il servizio per centottanta giorni dalla scadenza per presentarlo in base all'articolo 12, ma non verrà richiesto dalla persona che ne ha bisogno."
"L'impresa aggiudicataria si impegna a mantenere l'offerta valida per tutta la durata del contratto, fatta salva le revisioni di Legge.",6d52bcc84ee3fa9bfec74bb009537bd2,106,"L'azienda che ha una decisione vuole ancora vendere l'offerta per tutta la durata del contratto, senza fare revisioni attuali."
"È consentito il subappalto nella misura consentita dalla normativa vigente, purché indicato in sede di offerta ovvero successivamente previa autorizzazione della stazione appaltante.",6d52bcc84ee3fa9bfec74bb009537bd2,107,Deve essere fatto subappalto usando una tassa fatta prima dell'offerta o non possedere la autorizzazione della stazione che opera.
"Per eventuali richieste di informazioni e documenti complementari, nonché per chiarimenti di natura procedurale, il concorrente potrà rivolgersi, tramite richiesta scritta inviata via e-mail all'UFFICIO TECNICO del Comune di Rionero Sannitico.",6d52bcc84ee3fa9bfec74bb009537bd2,108,"Per richiedere informazioni o documenti importanti, la persona che ha bisogno di spiegazioni amministrative e consigli legali, posseduta presentare il permesso per posta elettronica all'ufficio tecnico del Comune di Rionero Sannitico."
"Le richieste di informazioni complementari e di chiarimenti, pena la non considerazione delle stesse, dovranno pervenire esclusivamente via e-mail all'indirizzo di posta sopraindicato e saranno riscontrate, sempre che siano state presentate in tempo utile, direttamente al richiedente per iscritto via e-mail e, se di interesse generale, saranno pubblicate in forma anonima sul sito del Comune di Rionero Sannitico, almeno sei giorni prima del termine ultimo di presentazione delle offerte.",6d52bcc84ee3fa9bfec74bb009537bd2,109,"Le richieste di informazioni complementari e chiarimenti devono essere inviate solo da un'email all'indirizzo precedente e saranno fatte direttamente al richiedente e, se non sono importanti, saranno pubblicate anonimamente sul sito del Comune di Rionero Sannitico almeno sei giorni prima di presentare le offerte."
"Tutti i documenti di gara, compreso il disciplinare tecnico e il capitolato speciale d'appalto, sono reperibili sul sito internet del Comune di Rionero Sannitico o ritirabili, previo pagamento delle spese, presso l'ufficio tecnico dello stesso Comune di Rionero Sannitico.",6d52bcc84ee3fa9bfec74bb009537bd2,110,"Il Comune di Rionero Sannitico può trovare tutti i documenti necessari per fare l'appalto sul sito web del Comune di Rionero Sannitico o ritirarlo, seguendo il capitolato speciale d'appalto, oppure rilasciati per pagare le spese presso l'ufficio tecnico del Comune dei Rinero Sannitico."
"Si informano i concorrenti che i dati raccolti saranno utilizzati esclusivamente per il perfezionamento della presente procedura, per l'attuazione dei rapporti contrattuali con l'aggiudicatario, per gli adempimenti contabili e fiscali. ",6d52bcc84ee3fa9bfec74bb009537bd2,111,"Si informano i concorrenti che i dati raccolti saranno raccolti solo per continuare a seguire le regole, per ottenere i rapporti contrattuali con l'aggiudicatario e per fare misure contabili e fiscali sul lavoro."
"I dati potranno essere trattati sia in forma cartacea sia in forma elettronica nel rispetto dei principi di liceità, correttezza, riservatezza e nel rispetto di tutte le misure di sicurezza prescritte dal D.lgs.196/2003.",6d52bcc84ee3fa9bfec74bb009537bd2,112,I dati potranno essere trattati sia in cartacea che in elettronica dopo aver fatto tutte le regole stabilite nel Decreto Legislativo 196/2003.
"I dati potranno essere comunicati alle imprese incaricate dal Comune di Rionero Sannitico (IS) dei servizi di informazione e comunicazione sulla gestione dei rifiuti, nonché ad istituti di credito per l'esecuzione dei pagamenti o a consulenti esterni per gli adempimenti contabili e fiscali nonché a Enti o Istituzioni in adempimento di quanto prescritto dalla Legge. ",6d52bcc84ee3fa9bfec74bb009537bd2,113,I dati potranno essere scritti alle imprese che hanno creato il Comune di Rionero Sannitico (IS) dei servizi di informazione e comunicazione sui rifiuti e ad istituti di credito per ottenere pagamenti o consulenti esterni per i pagamenti o per altri Enti o Istituzioni in base alla legge.
"I dati raccolti saranno soggetti, inoltre, alle forme di pubblicità prescritte dalle vigenti norme in materia di procedimenti amministrativi e di contratti pubblici. ",6d52bcc84ee3fa9bfec74bb009537bd2,114,I dati raccolti saranno fatti in modo pubblico nelle leggi sulla gestione delle autorità pubbliche e sulle contratti pubblici.
Il conferimento dei dati avrà carattere obbligatorio per la partecipazione alla presente procedura. La mancanza o l'incompletezza dei dati non consentirà di dar corso alla presente procedura e non consentirà l'ammissione del concorrente alla stessa. ,6d52bcc84ee3fa9bfec74bb009537bd2,115,Il conferimento dei dati sarà obbligatorio per partecipare a questa procedura. Non puoi badare a non sapere che i dati non sono incomplete e non permetterà al concorrente di presentarli.
Titolare del trattamento è il Comune di Rionero Sannitico (IS).,6d52bcc84ee3fa9bfec74bb009537bd2,116,Il Comune di Rionero Sannitico (IS) è la persona che gestisce il trattamento.
"I concorrenti dovranno ottenere, a pena di esclusione, il Certificato di sopralluogo e presa visione. Per partecipare alla gara, il legale rappresentante del concorrente, o un suo delegato, dovrà eseguire un sopralluogo su tutti i territori dove dovrà essere svolto il servizio. Il certificato di presa visione e sopralluogo dovrà necessariamente riportare il visto dei tecnici o personale delegato dei comuni appartenenti aera ""D""",6d52bcc84ee3fa9bfec74bb009537bd2,117,"I concorrenti devono ricevere il Certificato di sopralluogo e presa visione. Se non è lo stesso, il rappresentante legale del concorrente o un suo delegato devono controllare e farlo sul tutti i territorio dove verrà svolta la servizio. Il certificato di presa visione e presa visione deve essere rivolto a tutta la zona in cui verrà svolto la procedura. Il certificato dovrà essere scritto dai tecnici o dal personale delegato dei comuni del comune."
"A tal fine, per partecipare alla gara, il legale rappresentante del concorrente, o suo delegato, dovrà eseguire detto sopralluogo con il personale indicato tecnico comunale. Il sopralluogo potrà essere effettuato, fino al secondo e ultimo giorno previsto per la presentazione delle offerte previo appuntamento telefonico ai seguenti numeri",6d52bcc84ee3fa9bfec74bb009537bd2,118,"Per partecipare alla gara, il concorrente o il suo delegato deve fare un sopralluogo con il personale tecnico del comune. Questo sopralluogo può essere fatto fino al secondo e ultimo giorno. È necessario prenotare le offerte con un appuntamento telefonico ai seguenti numeri."
"A sopralluogo effettuato, il tecnico comunale rilascerà detta Certificato che andrà allegato alla documentazione di gara. Nel caso di Raggruppamenti Temporanei d'Impresa, Consorzi, aggregazioni di imprese di rete, GEIE, sia già formalmente costituiti sia da costituire, il Certificato di sopralluogo da allegare ai documenti di gara sarà quello dell'impresa mandataria capogruppo;",6d52bcc84ee3fa9bfec74bb009537bd2,119,"Il tecnico comunale rilascerà la documentazione che attesti sia ufficialmente allegato ai documenti di gara. Se ci sono un gruppo di imprese, associazioni e aziende di rete, verranno già formati o giàcostituiti, il certificato che sarà all'impresa responsabile dell'impresa mandataria della gara."
"l'Amministrazione si riserva di procedere all'aggiudicazione a anche nel caso in cui pervenisse una sola offerta valida, purché ritenuta congrua e conveniente, a proprio insindacabile giudizio. Si riserva, altresì, per qualsiasi causa legittima, di non procedere all'aggiudicazione o di annullare la gara, senza che i concorrenti possano pretendere nulla a qualsiasi titolo. Non saranno previsti rimborsi per la presentazione delle offerte;",6d52bcc84ee3fa9bfec74bb009537bd2,120,"L'Amministrazione può fare l'aggiudicazione solo se offre una sola offerta valida, ma non è responsabile della gara. Si riserva anche di non fare un'offerta specifica. Per qualsiasi motivo, si riserva la responsabilità della che i concorrenti possono chiedere di nullare la gara senza assicurare nulla a qualsiasi titolo."
"in caso di offerte con pari punteggio, si darà precedenza nell'ordine all'offerta: 
- che avrà riportato il maggior punteggio per l'offerta tecnica; 
- presentata per prima in base a data e ora di arrivo attestata dall'ufficio protocollo dell'Amministrazione",6d52bcc84ee3fa9bfec74bb009537bd2,121,"Se ci sono offerte con super punteggio, cerchiamo di specificare l'offerta: - che avrà il miglior punteggio per l'offerta tecnica; - che avrà un punteggio più importante per l'offerta tecnica; - che avrà una data e l'ora di arrivo già attesata dall'ufficio protocollo dell'Amministrazione."
"il subappalto è ammesso nei limiti di legge. Il concorrente è tenuto a indicare, in sede di presentazione dell'offerta, i servizi, le forniture e i lavori strumentali o le parti di servizi e forniture che intenderà eventualmente subappaltare. L'Amministrazione pagherà all'Affidatario il canone per i servizi comprensivo di quelli subappaltati. È fatto obbligo all'Affidatario di trasmettere, entro venti giorni dalla data di ciascun pagamento ricevuto copia delle fatture quietanzate relative ai pagamenti dallo stesso corrisposti al subappaltatore con l'indicazione delle ritenute di garanzia effettuate. Qualora l'Affidatario non trasmettesse le fatture quietanziate del subappaltatore entro il predetto termine, l'Amministrazione sospenderà il successivo pagamento a favore dell'Affidatario;",6d52bcc84ee3fa9bfec74bb009537bd2,122,"Il subappalto può essere fatto in base alle leggi. Il concorrente deve tenere in considerazione i servizi, le forniture e i lavori strumentali che intenderanno appaltare. L'Amministrazione deve fare le condizioni per presentare i servizi offerti devono essere compilati entro venti giorni dalla data in cui riceverà un pagamento la persona entro la quale riceverà la fattura, con indicata le ritenute di garanzia. Se l'azienda non trasmette le fatture, lo invia entro il termine giusto, l'Amministrazione sospenderà il pagamento per ridurre il pagamento in caso di pagamento."
le eventuali controversie riferite all'esecuzione del contratto (ivi comprese quelle concernenti la sua interpretazione) saranno risolte secondo quanto previsto dall'art. 31 del Capitolato Speciale;,6d52bcc84ee3fa9bfec74bb009537bd2,123,"Se le cose che fanno e le cosa devono essere presa come indicato, si interruiscono con l'articolo 31 del Capitolato Speciale, il contratto verrà valutato secondo quanto previsto dall'articolo 31 del Capitolato Speciale, quando la sua interpretazione richiede."
"costituiscono parte integrante e sostanziale del presente Bando, il Disciplinare di gara e i relativi allegati e il Capitolato Speciale e i relativi allegati;",6d52bcc84ee3fa9bfec74bb009537bd2,124,"I bidoni principalmente partecipati alla garanzia, il Disciplinare di gara e i relativi allegati, il Capitolato Speciale e i allegati."
"al termine della procedura, l'Amministrazione procederà tempestivamente alle comunicazioni come previsto dal D.lgs. 50/2016. Ai fini della stipulazione del contratto, sarà rispettato il termine dilatorio di cui all'art. 32, comma 9, del D.lgs. 50/2016, per cui il contratto non potrà essere stipulato prima di trentacinque giorni dall'invio dell'ultima delle comunicazioni del provvedimento di aggiudicazione definitiva.",6d52bcc84ee3fa9bfec74bb009537bd2,125,"Dopo aver completato il processo, la mministrazione comunicarà tempestivamente in modo chiaro e conforme alle comunicazioni indicate nel decreto legislativo 50/2016. Per stipulare il contratto, sarà rispettato la data per firmare il contratto prima di trentaquattro giorni dalla fine della procedura."
"nella domanda di partecipazione, il concorrente sarà tenuto a indicare il proprio numero di fax, la propria PEC e il proprio domicilio eletto per le comunicazioni previste ai sensi del D.Lgs. 50/2016;",6d52bcc84ee3fa9bfec74bb009537bd2,126,"quando ti proponedo una partecipazione, il partecipante deve dimostrare a scrivere il numero di fax, l' email e il paese eletto."
"ai sensi e per gli effetti dell'art. 209 comma 2 del D.lgs. 50/20106, il contratto non conterrà la clausola compromissoria;",6d52bcc84ee3fa9bfec74bb009537bd2,127,"Secondo l'articolo 209 comma 2 del Decreto Legislativo 50/20106, il contratto non escluderà i rimborsi."
il contratto sarà stipulato mediante forma pubblica amministrativa a cura dell'ufficiale rogante dell'Amministrazione. Tutte le spese contrattuali e conseguenti sono a carico dell'impresa affidataria;,6d52bcc84ee3fa9bfec74bb009537bd2,128,"Il contratto sarà firmato tramite posta pubblica per aiutare l'ufficiale dello stesso azienda che fornisce tutte le spese che risparmiano, come consentito dall'azienda affidataria."
"in caso di fallimento dell'Affidatario o di risoluzione del contratto per grave inadempimento del medesimo, l'Amministrazione interpellerà progressivamente i soggetti che hanno partecipato all'originaria procedura di gara, risultanti dalla relativa graduatoria, al fine di stipulare un nuovo contratto per l'affidamento del completamento dei lavori. Si procede all'interpello a partire dal soggetto che ha formulato la prima migliore offerta, fino al quinto migliore offerente escluso l'originario aggiudicatario. L'affidamento avviene alle medesime condizioni già proposte dall'originario aggiudicatario in sede in offerta;",6d52bcc84ee3fa9bfec74bb009537bd2,129,"Se ci sono problemi legati all'asta o alla risoluzione dei contratti per grave inadempimento, l'Amministrazione richiede a tutti i partecipanti a una gara al caso su validi motivi. Ti farerà un'opinione al settore in cui si fa un'offerta per completare i lavori, come indicato nella lista. Si revoca il responsabile che ha riscontrato la prima migliore offerta, fino al quinto migliore avvenire anche qualcun incaricato. I lavori saranno presentati in base alle stesse condizioni già fornite dall'autorizzazione in sede in offerta."
nel caso di discordanza tra il bando e gli altri atti di gara prevarrà il bando.,6d52bcc84ee3fa9bfec74bb009537bd2,130,"Se si tratta di una differenza tra il bando e altri atti di gara, verrà poi scelto un nuovo bando."
Procedure di ricorso giurisdizionale amministrativo e strumenti di tutela delle controversie,6d52bcc84ee3fa9bfec74bb009537bd2,131,Le regole per decidere se si occupa di ridurre le controversie e se si tratta di un controllo pubblico sulle controversie.
"soggetti che intendono proporre un ricorso giurisdizionale devono informare questa stazione appaltante, con comunicazione scritta e sottoscritta dall'interessato, o da un suo rappresentante e nel rispetto delle modalità ivi previste, della presunta violazione e dell'intenzione di proporre un ricorso giurisdizionale.",6d52bcc84ee3fa9bfec74bb009537bd2,132,"Si impegnano a mettere in atto un ruolo giurisdizionale, attraverso la comunicazione scritta dall'interessato al suo rappresentante, o da un suo rappresentante, per rispettare le regole attuali."
"Tutte le norme poste dal presente Bando e Disciplinare di gara dovranno essere ritenute essenziali per l'ammissione alla gara e, quindi, essere tutte scrupolosamente rispettate e applicate. ",6d52bcc84ee3fa9bfec74bb009537bd2,133,"Tutte le regole scritte nel Bando e del Disciplinare di gara dovranno essere rispettate e rispettate per fare un'asta. Quindi, devono essere rispettate e applicate."
"Si sottolinea che l'EFFETTIVA ESCLUSIONE dalla procedura d'appalto del concorrente sarà disposta dalla stazione appaltante/Commissione di gara nei casi di incertezza assoluta sul contenuto o sulla provenienza dell'offerta, per difetto di sottoscrizione o di altri elementi essenziali ovvero in caso di non integrità dei plichi contenenti l'offerta, l'offerta tecnica o la domanda di partecipazione alla gara o altre irregolarità relative alla chiusura dei plichi, tali da far ritenere, secondo le circostanze concrete, che sia stato violato il principio di segretezza delle offerte.",6d52bcc84ee3fa9bfec74bb009537bd2,134,"La regola fatta dall'appalto del concorrente sarà disposta dalla stazione appaltante/commissione di lavoro se sono verificate le sue idee, in situazioni difficili da considerare o per vendere in qualcosa, non è importante firmare informazioni importanti o non sono adatti alle sue proposte. Tuttavia, è importante sottolineare se non è stato rispettato il principio di segretezza delle offerte."
"La realtà, sempre più completa ed articolata, delle pubbliche amministrazioni, se da un lato, consente di offrire servizi diversificati alla cittadinanza, dall'altro si presenta spesso come un mondo di difficile accesso da parte del cittadino.",70da2ae575436d19518deae1ff2125b0,1,La realtà più completa e separata delle pubbliche amministrazioni permette di offrere servizi diverse ai cittadini. È più difficile accesso ai servizi offerti a tutti.
"In questo contesto, il principio ispiratore della carta dei servizi, è sicuramente quello di garantire il cittadino, mettendolo in condizione di conoscere ed accedere agevolmente ai pubblici servizi, erogati in un'ottica di trasparenza, imparzialità ed eguaglianza.",70da2ae575436d19518deae1ff2125b0,2,"In questo contesto, questo principio è permettere al cittadino di conoscere e accedere ai servizi di servizi pubblici, basandosi su regole chiare e imparzialità e età chiare."
"La carta dei servizi rappresenta dunque, lo strumento fondamentale, attraverso il quale, il Corpo di Polizia Municipale del Comune di Firenze, intende far conoscere alla collettività il proprio modo di operare nel rispetto della legislazione vigente in materia di tutela sociale e qualità del servizio svolto.",70da2ae575436d19518deae1ff2125b0,3,"La carta dei servizi è un strumento importante che il Corpo di Polizia Municipale del Comune di Firenze vuole spiegare agli utenti come operare in modo uguale e buono, seguendo le regole stabilite per proteggere la comunità e la qualità del servizio svolto."
"Al fine di assicurare la costante corrispondenza fra la carta dei servizi e la realtà dell'organizzazione, il documento viene periodicamente riesaminato ed aggiornato.",70da2ae575436d19518deae1ff2125b0,4,"Per assicurare che la carta dei servizi sia chiara e completa, il documento verrà aggiornato regolarmente in modo aggiornato."
"Il Corpo di Polizia Municipale di Firenze svolge dal 1854 le funzioni di polizia locale nella città. Secondo quanto previsto dalla normativa vigente (Legge 15 marzo 1986 n. 65 e da L.R. 19 febbraio 2020 n.11 Norme in materia di sicurezza urbana integrata e polizia locale). La Polizia Municipale espleta una molteplicità di compiti e funzioni che nel tempo si sono notevolmente ampliate e diversificate al fine di rispondere alle mutevoli esigenze della città e dei cittadini, al fine di garantire la convivenza civile e la tutela dei diritti di ognuno. Infatti, la Polizia Municipale opera per prevenire e reprime le violazioni alle norme contenute in leggi, regolamenti e provvedimenti dello Stato, della Regione e del Comune attraverso le funzioni di polizia stradale, giudiziaria e di pubblica sicurezza; opera altresì in ambito di informazione, notificazione, accertamento e rilevazione connessi alle proprie funzioni istituzionali. Inoltre vigila sulla integrità e conservazione del patrimonio pubblico e presta opera di soccorso alla popolazione e collabora ai servizi e alle operazioni di protezione civile.",70da2ae575436d19518deae1ff2125b0,5,"Il Corpo di Polizia Municipale di Firenze ha la sua capacità di gestire le strade nella città. Questa Polizia Municipale sta lavorando nel 1854. La Polizia Municipale si occupa di fornire compiti, agendo in modo diverso e diversificato, per proteggere le esigenze della città e dei cittadini. Inoltre, si occupa anche di informare e raccogliere informazioni e verificare le regole definite dallo Stato, dalla Regione e dal Comune, per proteggere i servizi sanitari di Firenze."
La Direzione Corpo di Polizia Municipale è composta da circa 815 appartenenti al Corpo a cui si aggiungono 95 addetti amministrativi.,70da2ae575436d19518deae1ff2125b0,6,"La Direzione Corpo di Polizia Municipale è composta da circa 815 persone che fanno parte del Corpo di Polizia Municipale, che l'aiuto di 88 persone amministrative."
"A presidio del territorio operano nel centro storico i Reparti Zona Centrale, Porta Romana, Fortezza e la Polizia a Cavallo, mentre nelle zone periferiche si trovano i Reparti Campo Marte, Gavinana, Isolotto e Rifredi. A questi si aggiunge l'attività svolta dal Reparto Polizia di Comunità che garantisce una capillare presenza sul territorio a garanzia della sicurezza dei cittadini. Tutto il personale di questi reparti effettua servizio in strada con particolare attenzione ai luoghi di aggregazione, come giardini e piazze ed è dunque a disposizione della cittadinanza per raccogliere le segnalazioni e rispondere alle necessità di presenza e di vicinanza e creare così una rete di contatto fra cittadini e Polizia Municipale quale primo referente con l'Amministrazione Comunale.",70da2ae575436d19518deae1ff2125b0,7,"Nel centro storico i Repartimenti Zona Centrale, Porta Roma, Fortezza e la Polizia a Cavallo. Nei luoghi principale ci sono Repartimenti Campo Marte, Gavinana, Isolotto e Rifredi. Inoltre, i reparti aiutano a rendere più sicuri i cittadini. Anche il personale di questi reparti mettono in atto l'attività dei reparti come giardini e piazze e aiuta le persone a raccogliere le sapere in questioni e a proteggere le loro esigenze. È anche importante tenere contatto con la Polizia Municipale, in linea con il nostro punto di partenza."
