original_text,document,paragraph_index,simplified_text
"Le presenti Linee programmatiche definiscono gli indirizzi per la programmazione regionale, stabilendo le linee di azione e organizzative prioritarie per il Sistema sanitario regionale attuazione della riforma territoriale ai sensi del DM 23 maggio 2022, n. 77. Tali linee programmatiche, che devono essere declinate nella programmazione attuativa aziendale non si intendono esaustive delle attività e dei servizi che devono essere garantiti in adempimento della normativa statale e regionale, ma indicano le priorità individuate dalla Regione. Il presente documento indirizza le funzionalità, i modelli organizzativi e di servizio, i mix di professionalità necessari per il concreto avvio delle Case di Comunità (CdC), Ospedali di Comunità (OdC), Centrali Operative Territoriali (COT), Infermiere di Famiglia e Comunità (IFeC), Assistenza Domiciliare Integrata (ADI) e tutte le altre componenti rilevanti per lo sviluppo dei servizi territoriali per promuovere la prevenzione primaria, migliorare l'accessibilità, in modo particolare quelli affetti da patologie croniche e dell'area della fragilità, in coerenza anche con le previsioni del PNRR, dell'evoluzione dell'ecosistema digitale e del modello di governance dell'area della fragilità e della cronicità realizzando un quadro organico ed armonico di evoluzione del Sistema Socio Sanitario Regionale SSSR. ",99bdc9fdd8097f067f77cb220074b1b5,1,"Le linee programmatiche dicono le azioni per la pianificazione della regione. Questi criteri indicano il Sistema sanitario regionale e includeno le priorità identificate dalla Regione. Bisogna seguire le funzionalità, i modelli organizzativi e i servizi necessari per rendere più sicure le case di comunità (CdC), Ospedali di Comunità (OdC), Centrali Operative Territoriali (COT), Infermiere di Famiglia e Comunità (IFeC) e altre altre parti importanti per promuovere la prevenzione primaria, migliorare l'accesso, in particolare quelli affetti da malattie croniche e fragilità, contrastando le linee guida del PNRR, dell'evoluzione dell'ecosistema digitale e del modello di gestione dell'area fragile e della fragilità, usando un quadro efficace ed armonico del Sistema Socio Sanitario Regionale SSSR."
"La situazione demografica, sanitaria, socio-economica e tecnologica della Regione Basilicata e, in una scala maggiore dell'intero Paese, è profondamente cambiata. La pandemia e le crisi socio-economiche hanno ovunque acuito le diseguaglianze e hanno evidenziato che la resilienza dei sistemi organizzati di welfare deve essere irrobustita dal punto di vista del finanziamento, dell'organizzazione a rete, del rispetto delle esigenze dei territori, del ruolo e del protagonismo degli operatori e dei cittadini in un'ottica di comunità, specialmente in un contesto di progressivo invecchiamento della popolazione e di aumentata prevalenza di malattie croniche. Le tecnologie mediche ed informatiche offrono nuove opportunità di cura e assistenza che richiedono competenze, lavoro di equipe, semplificazione organizzativa, anche in ottica di revisione continua dei processi.",99bdc9fdd8097f067f77cb220074b1b5,2,"La salute e l'economia dello Stato Basilicata stanno cambiando. La pandemia e le crisi economiche hanno cambiato e sono state prese in pratica. Questo ha causato problemi di finanziamento, organizzazione, ruolo e impegno delle persone con malattie croniche. Le tecnologie mediche e informatiche offrono nuove opportunità per curare e assistenza nel modo migliore, ma coinvolgeno principalmente quelli che stanno cambiando le situazioni demografiche."
"L'analisi di contesto della popolazione residente in Basilicata evidenzia come la popolazione anziana (over 65) rappresenti il 23% della popolazione totale nella Regione, percentuale in linea con la media nazionale ",99bdc9fdd8097f067f77cb220074b1b5,3,"L'analisi della popolazione che vive in Basilicata mostra che la popolazione anziana ha totale l'over 65 abitanti, mentre la media nazionale ha i risultati, seguendo la media nazionale."
"La Basilicata ha una superficie di 10.073 kmq con 553.254 abitanti (2019) distribuiti su 131 Comuni, per una densità pari a 54,92 abitanti per kmq. di gran lunga inferiore alla densità media nazionale che è 200 abitanti per kmq. L'età media è 45,7 anni contro i 45, dell'Italia. Il confronto con i dati del Censimento 2011 evidenzia un progressivo invecchiamento della popolazione, con ritmi superiori alla media nazionale. Tutte le classi di età sotto i 50 anni vedono diminuire il proprio peso relativo rispetto al 2011. L'indice di vecchiaia è 200,8; la percentuale della popolazione ultrasessantacinquenne è 23,9%. La rete dei servizi territoriali è governata tramite due Aziende Sanitarie, ASP e ASM. Il territorio dell'Azienda Sanitaria di Potenza (ASP) coincide con quello dell'intera provincia e ha una superficie di 6.546 Kmq suddivisa in 100 comuni nei quali è distribuita una popolazione complessiva di circa 358.000 abitanti (di questi 66.393 concentrati nel comune di Potenza); l'indice di vecchiaia è 207,4, significativamente più alto rispetto al dato regionale e alla provincia di Matera (che si attesta a 189,4). Il territorio della Azienda Sanitaria di Matera (ASM) ha una superficie di 3.527 kmq suddivisa in 31 Comuni con una popolazione complessiva di circa 195.000 abitanti (rif. prospetto 1). ",99bdc9fdd8097f067f77cb220074b1b5,4,"La Basilicata ha 10.073 kmq con 553.254 abitanti nella regione Basilicata. La popolazione ha la maggior parte degli abitanti rispetto alla media nazionale è 55 milioni di persone. Sembra che possano rispettare alla media nazionale quante volte l'attualmente circa 200 milioni di persone per ogni residenti. La media è 45,7 anni e è 45,7 anni a 46, l'Italia. Il confronto con i dati del Censimento 2011 mostra una invecchiamento progressivo della popolazione. Tutte le persone sotto i 50 anni vengono a livello nazionale un invecchiamento delle persone, con un maggiore peso rispetto al 2011. La maggior parte della popolazione ha più grandi di circa 45 anni, e la percentuale di giovani è 23,9%. La rete dei servizi territoriali si occupata dalle due Aziende Sanitarie, ASP e ASM. Il territorio dell'Azienda Sanitaria di Potenza (ASP) è in collegamento con due Aziende Sanitarie, ASP e ASM. La comunità Azienda Sanitaria di Potenza (ASL) del territorio e ha una superficie di 6.546 kmq in 100 comuni. La maggior parte dei servizi territoriali lavora in due Aziende Sanitarie, ASP e ASM. Il territorio dell'Area Sanitaria di Potenza ha circa 356.000 abitanti. L'indice di vecchiaia è 20,8 litri media nella provincia. La popolazione totale di circa 205.000 abitanti si concentra sul territorio della regione e un numero di circa 195.000 persone."
Molto interessante è l'aspetto della tendenza demografica degli ultimi 70 anni in particolare in termini di spopolamento di alcune aree territoriali che deve far riflettere sulla modalità di configurazione della Case della Comunità e sulle opportunità offerte dalle nuove tecnologie per tenere in rete cittadini che vivono sparsi sul territorio. ,99bdc9fdd8097f067f77cb220074b1b5,5,"Se ci sono ancora problemi di demografia delle strade negli ultimi 70 anni, considerando anche la situazione nella tendenza della situazione di spopolamento di alcune zone e nelle opportunità previste dalla nuova tecnologia per garantire servizi nella rete delle persone che vivono di fuori della zona."
"Se guardiamo alla tendenza demografica dei comuni e alla piramide d'età del nostro territorio ne desumiamo sicuramente un'esigenza fondamentale sul fronte dei servizi: o la Regione Basilicata investe sui servizi di territorio con innovazione, incremento delle numerosità e varietà di servizi e capacità di governo o uscirà sconfitta dalla evoluzione naturale delle cose. ",99bdc9fdd8097f067f77cb220074b1b5,6,"Se l'età è molto forte e i vari servizi del nostro territorio, ci sono molte i problemi principali per i servizi. Abbiamo un aiuto importante per tutti i comuni, aiutando a diventare più efficienti, aiutando a gestire meglio i servizi della regione, e prenderà decisioni positive sul futuro."
"La tendenza ad un aumento delle condizioni di fragilità psico-fisica della popolazione lucana si conferma anche dall'andamento della percentuale delle persone con Indice di Comorbidità di Charlson (ICC) maggiore o uguale a uno sul totale dei pazienti ricoverati in strutture ospedaliere regionali. Nel periodo 2015-2020 la percentuale di pazienti con ICC >=1 registra, per le province di Potenza e Matera, un aumento rispettivamente di +4,3% e +5,4%. ",99bdc9fdd8097f067f77cb220074b1b5,7,"La popolazione lucana sta aumentando i guadagni nelle condizioni di fragilità psicologica della popolazione lucana da un aumento della percentuale di persone con gravi rischi di salute alle persone, anche dai tempi del 2015. Il 2015-2020, il numero di pazienti con un Indice di Comorbidità di Charlson (ICC) aumenta di +4,3% e +5,4% dei pazienti, in ospedali regionali. Nella regione, il numero di pazienti con un ICC >=1 aumenta di +4,3% e +5,4%."
La distribuzione per comune dell'ICC mette in luce la presenza di aree geografiche caratterizzate da una quota elevata di popolazione affetta da patologie croniche.,99bdc9fdd8097f067f77cb220074b1b5,8,La distribuzione nell'ICC mette in atto situazioni di varie aree geografiche con una piccola popolazione con malattie croniche.
"Si rende necessario adeguare il livello dell'Assistenza Distrettuale, come definito dal Capo III, art. 3-20, del DPCM LEA 12 gennaio 2017e dal Decreto 23 maggio 2022, n. 77 art. 1 allegato 1 e allegato 2 prescrittivo. ",99bdc9fdd8097f067f77cb220074b1b5,9,"Gli assistenza distrettuale devono essere mantenuti bene e curati secondo le regole del Decreto Legislativo del 12 gennaio 2017e del Decreto 23 maggio 2022, numero 77, articoli 1 allegato 1 e 2 prescrittivo."
"Il presente Piano Operativo Territoriale è finalizzato a promuovere, attraverso gli strumenti del governo clinico, la qualità dell'assistenza, vale a dire un'assistenza che sia: 
- Efficace, fornendo servizi sanitari basati sull'evidenza a coloro che ne hanno bisogno; 
- Sicura, evitando danni alle persone cui è destinata la cura;
- Centrata sulle persone, fornendo cure che rispondano alle preferenze, ai bisogni e ai valori delle singole persone, così come alle culture delle loro comunità; 
- Tempestiva, riducendo i tempi di attesa e ritardi talvolta dannosi sia per chi riceve che per chi presta assistenza;
- Equa, fornendo la stessa qualità di assistenza indipendentemente da età, sesso, razza, etnia, posizione geografica, religione, stato socioeconomico, affiliazione linguistica o politica; 
- Integrata, fornendo cure coordinate tra livelli ed erogatori e rendendo disponibile l'intera gamma di servizi sanitari durante tutto il corso della vita;
- Efficiente, massimizzando il beneficio delle risorse disponibili ed evitando sprechi",99bdc9fdd8097f067f77cb220074b1b5,10,"Questo Piano Operativo Territoriale aiuta le persone a assicurare la qualità dell'assistenza in base alle proprie esigenze. Ci sono servizi sanitari validi per certi tipi di persone che ne hanno bisogno. Inoltre, sicura, evitando danni a chi riceve l'assistenza. Sicura, evitando danni per i pazienti, riducendo i ritardi, riducendo i ritardi all'attesa per chi riceve servizi più intensive e evitando sprechi."
"Per il raggiungimento delle finalità sopra richiamate sono stati individuati i quattro obiettivi strategici di seguito elencati:
- Garantire e stimolare il miglioramento continuo della qualità dell'assistenza 
- Favorire la prossimità e l'appropriatezza 
- Valorizzare il governo del rischio clinico 
- Assicurare l'equità e promuovere la partecipazione dei pazienti, familiari, cittadini e delle loro organizzazioni rappresentative",99bdc9fdd8097f067f77cb220074b1b5,11,"Per raggiungere nuovi obiettivi sul posto sono stati individuati quattro obiettivi strategici da parte: - Usare e migliorare costantemente l'assistenza alle esigenze dell'assistenza - Identificare la presenza e l'appropriatezza - Coinvolgere i pazienti, le loro famiglie, i cittadini e le loro organizzazioni rappresentative."
"La componente sanitaria deve operare in stretto raccordo con la componente sociale, al fine di garantire in maniera integrata e coordinata le prestazioni sociosanitarie, siano queste a rilevanza sanitaria o sociale, come ribadito anche dal Piano Sociale Nazionale 2021-2023 predisposto in attuazione dell'art. 21 del D.Lgs. 147/2017che rimarca l'importanza che l'integrazione avvenga già dalla fase programmatoria, in quanto è necessario dare risposte ""opportune al cittadino senza che esso venga rinviato a competenze di altri enti e livelli istituzionali"". ",99bdc9fdd8097f067f77cb220074b1b5,12,"La componente sanitaria deve lavorare bene con l'assistenza sanitaria, per garantire in modo coordinato le prestazioni sanitarie a favore sanitaria o sociale, come stabilito anche dalla fase di programmazione di nuove prestazioni sanitarie. Questa è riconosciuta dagli accordi con la società e dall'articolo 21 del Decreto Legislativo 147/2017. Questo piano riguarda l'importanza che l'integrazione avvenga già dalla fase pianificazione, perché è necessario dare risposte al cittadino senza che essi è rinviato a competenze altri enti e livelli istituzionali."
"La programmazione locale non può prescindere dalla preliminare identificazione formale delle responsabilità specifiche nella conduzione integrata degli interventi, dei soggetti istituzionali presenti sul territorio (in particolare Azienda sanitaria locale e Comune), nel rispetto delle disposizioni normative che regolamentano la materia. ",99bdc9fdd8097f067f77cb220074b1b5,13,"Promuovere le partecipazioni locali non possono capire quali sono le responsabilità specifiche per gestire gli interventi, ad esempio i dipendenti della regione e della comunità, nel rispetto delle regole che regolano la programmazione."
"Tale identificazione, inoltre, dovrà precisare gli impegni che fanno capo a ciascun soggetto e le procedure da adottare per realizzare un efficace coordinamento. In particolare, gli atti programmatori dovranno individuare a livello territoriale-distrettuale le specifiche modalità operative che consentano ai servizi sanitari e sociali di integrare le risorse professionali, organizzative e finanziarie in una rete che moltiplichi i benefici di ciascun intervento anziché vanificarne gli effetti. ",99bdc9fdd8097f067f77cb220074b1b5,14,"Questa identificazione dovrà includere gli impegni che fanno parte a ogni cliente e le procedure da seguire per coordinare meglio i servizi sanitari e sociali. Il programma deve identificare le modalità operative per facilitare un coordinamento efficace. In particolare, gli atti programmatori dovranno trovare un modo in cui ci sono le risorse professionali, organizzative e finanziarie in una rete che coinvolge i servizi sanitari e sociali per coinvolgere le risorse professionali, organizzative e finanziarie in un sistema in maniera che coinvolge i benefici ogni intervento."
"L'integrazione sociosanitaria va attuata e verificata, salvaguardando la specificità di ciascuna professionalità coinvolta, a tre livelli:
- istituzionale: Si realizza attraverso la collaborazione tra istituzioni sociali e sanitarie per la definizione di scelte programmatorie volte a realizzare comuni obiettivi di salute; 
- gestionale: È relativa alle modalità di gestione che possono promuovere e facilitare percorsi di continuità assistenziale, rispondendo in modo esaustivo e in senso multidimensionale al bisogno complesso di salute; 
- professionale: Si realizza nella collaborazione tra diverse culture professionali nella gestione del sistema dell'offerta, attraverso l'unitarietà di protocolli degli interventi",99bdc9fdd8097f067f77cb220074b1b5,15,"L'integrazione tra i vari tipi di assistenza sanitaria viene controllata e verificata, senza dover menzionare alcune aziende coinvolte. Questo include: - Si tratta di due livelli: - Se seleziona istituzioni sociali e sanitarie per decidere quali obiettivi di salute sono importanti per garantire cure continuamente ed a seguire le esigenze compleste di salute; - Se è possibile coinvolgere diversi professionisti nella gestione del sistema di supporto, viene coordinate di procedure di intervento in modo completo e adeguato, rispettando al bisogno di salute. - La professione: Si tratta di collaborazioni tra diverse culture professionali per gestire il sistema dell'offerta da parte di diverse discipline professionali per gestire l'offerta, utilizzando protocolli per intervenire in modo completo."
"Gli strumenti per la programmazione integrata e negoziata dei servizi, a livello locale, sono il Piano delle Attività Territoriali previsto dall'art. 3-quater del D.Lgs. 502/92 e smi di cui è titolare il Distretto ed il Piano di Zona, la cui titolarità spetta all'Ente di ambito sociale, con l'apporto sinergico delle molteplici realtà locali. ",99bdc9fdd8097f067f77cb220074b1b5,16,"I strumenti per programmire e gestire i servizi in zona sono il Piano delle Attività Territoriali previsto dall'articolo 3-quater del Decreto Legislativo 502/92, che è l'Ente di ambito sociale, con la collaborazione con molte realtà locali."
"Il Piano delle Attività Territoriali (PAT) ed il Piano di Zona (PdZ) dovranno, necessariamente coincidere nei contenuti della programmazione dell'area dell'integrazione sociosanitaria, anche se approvati con modalità temporali diverse. A tal fine, sarà utilizzato lo strumento dell'accordo di programma, tra ASL ed ambito sociale, che dovrà recepire quanto previsto dal PdZ o dal PAT in materia di servizi e risorse da attivare nell'area dell'integrazione sociosanitaria. ",99bdc9fdd8097f067f77cb220074b1b5,17,"Il Piano delle Attività Territoriali e il Piano di Zona (PdZ) dovranno coincidere nei contenuti della pianificazione del servizio sanitario, anche se approvati in conferenze diverse. Ad esempio, verrà utilizzato la legge regionale con il Piano di Zona che stabilisce quanto previsto dal PdZ o dal PAT, per attivare servizi e risorse per attivare l'intera comunità."
"Al fine di garantire la coincidenza tra gli AST e i nuovi ambiti distrettuali, il presente documento programmatico prevede il mantenimento degli ambiti sociali territoriali come ad oggi disegnati conservando quindi la loro costituzione primaria ma risulteranno accorpati solo nella declinazione di alcuni nuovi ambiti distrettuali rendendoli pertanto comunque omogenei in questi ultimi. ",99bdc9fdd8097f067f77cb220074b1b5,18,"Per assicurare che ci sia la differenza tra gli ospedali e i nuovi distretti territoriali, questo documento programmaticoprevede che le persone abbiano una costituzione primaria e risulteranno comunque separate in questi ambiti."
"Il Servizio Sanitario Regionale (SSR) e gli AST in via prioritaria, garantiscono in modo integrato le attività riguardanti l'accesso ai servizi sanitari e sociali e la presa in carico delle persone non autosufficienti e disabili. ",99bdc9fdd8097f067f77cb220074b1b5,19,Il Servizio Sanitario Regionale (SSR) e gli AST aiutano a le persone con disabilità e disabili a accedere a servizi sanitari e sociali.
"La Regione Basilicata intende, pertanto, attivare un modello organizzativo che consenta un utilizzo funzionale e coordinato delle risorse, anche professionali, capace di mettere in rete le prestazioni di maggior impatto sulle situazioni di disagio personale e sociale, erogate in tutti gli ambiti previsti dai LEA anche al fine di ""garantire il benessere psicologico individuale e collettivo"" della popolazione, così come previsto anche dal comma 2 dell'art. 29 ter della Legge del 13/10/2020, n. 126. In questo ambito le farmacie convenzionate con il SSN ubicate uniformemente sull'intero territorio nazionale, costituiscono presidi sanitari di prossimità e rappresentano un elemento fondamentale ed integrante del Servizio sanitario nazionale. ",99bdc9fdd8097f067f77cb220074b1b5,20,"La Regione Basilicata vuole sviluppare un sistema organizzativo che permetta di offrire le risorse funzionali e coordinati sulle situazioni di disagio personale e sociale, offrendo in tutti gli ambiti previsti dai LEA. Il sistema viene assegnato in modo organizzato, sia per garantire il benessere psicologico personale che collettivo, come previsto dalla Legge del 13/10/2020, n. 126. In questo caso, le farmacie convenzionate con il SSN, sono presidi sanitari di prossimità e sono principalmente importanti per la salute dell'Italia, come previsto dall'articolo 29 ter della Legge del 13/10/2020, numero126. Nell'Ambito regionale, le farmacie convenzionate con il SSN, sono considerate in linea con la Legge del 13/10/2020."
"In particolare, la rete capillare delle farmacie convenzionate con il SSN assicura quotidianamente prestazioni di servizi sanitari a presidio della salute della cittadinanza: in tale ambito vanno inquadrate la dispensazione del farmaco, per i pazienti cronici la possibilità di usufruire di un servizio di accesso personalizzato ai farmaci, la farmacovigilanza, le attività riservate alle farmacie dalla normativa sulla c.d. ""Farmacia dei Servizi"" (D. Lgs. 153/2009) e l'assegnazione delle nuove funzioni tra le quali le vaccinazioni anti-Covid e antinfluenzali, la somministrazione di test diagnostici nell'ambito di piani di tutela della salute pubblica individuati dalla regione. ",99bdc9fdd8097f067f77cb220074b1b5,21,"La rete sanitaria convenzionata con il SSN offre servizi sanitari sui pazienti con malattie croniche. Questo avviene quando i pazienti delle malattie croniche devono essere serviti, la preparazione dei farmaci, e le attività svolte per le farmacie, le modalità per curare i farmaci. Queste attività includono i vaccini anti-Covid e antinfluenzali e l'assegnazione di test diagnostici nel calendario di piani di tutela della salute pubblica della regione."
"La Regione individuerà un piano per lo sviluppo delle attività svolte dalle farmacie perché siano, ad invarianza dei costi, parte integrante della rete territoriale dell'assistenza di prossimità, e della digitalizzazione dell'assistenza sanitaria. ",99bdc9fdd8097f067f77cb220074b1b5,22,"La Regione vuole creare un piano per rendere le attività svolte dalle farmacie per prevenire problemi e i costi. Inoltre, aiuterà le strutture sanitarie a digitalizzare l'assistenza sanitaria a mettendo traccia dei costi."
"Il presente documento definisce modelli organizzativi, standard e le principali tematiche connesse agli interventi previsti nell'ambito della Missione 6 Component 1 ""Reti di prossimità, strutture e telemedicina per l'assistenza sanitaria territoriale"" del PNRR, che sono considerate in una ottica più ampia ed integrata anche attraverso l'analisi di strumenti e ruoli trasversali propedeutici al potenziamento dell'assistenza territoriale.",99bdc9fdd8097f067f77cb220074b1b5,23,"Ciò che c'è il documento stabilisce dei modelli organizzativi, standard e su come operare in più zone o strutture per l'assistenza sanitaria locale. Le regole di questo documento sono definite in modo più ampia e integrato, anche analizzando strumenti e ruoli che serve per migliorare l'assistenza sanitaria nella zona."
"Il Piano Nazionale di Ripresa e Resilienza (PNRR), inviato il 30 aprile alla Commissione europea e approvato il 22 giugno dalla Commissione Europea e il 13 luglio dal Consiglio Economia e Finanza (Ecofin), è la risposta strategica ai problemi strutturali, organizzativi e sociali presenti in Italia ed evidenziati a seguito dalla pandemia da Covid 19. Il Piano si articola in 6 Missioni, ovvero aree tematiche principali su cui intervenire, individuate in piena coerenza con i 6 pilastri del Next Generation EU: digitalizzazione, innovazione, competitività e cultura; transizione ecologica; infrastrutture per una mobilità sostenibile; istruzione e ricerca; Inclusione e coesione e salute. Le Missioni si articolano in Componenti, ovvero aree di intervento che affrontano sfide specifiche, composte a loro volta da Investimenti e Riforme.",99bdc9fdd8097f067f77cb220074b1b5,24,"Il Piano Nazionale di Ripresa e Resilienza (PNRR) è un piano da parte dei Regioni Italia e approvato il 22 giugno dalla Commissione Europea e Il 13 luglio dal Consiglio Economia e Finanza (Ecofin). Questo piano è diviso in 6 Missioni, come digitalizzazione, innovazione, competitività e cultura, transizione ecologica, infrastrutture per una mobilità sostenibile, istruzione e ricerca, inclusione e salute. Le Missioni sono principali da Gruppi o aree per interventi, composti a loro volta da Investimenti e Riforme."
"Nello specifico, la Missione 6 Salute mira a potenziare e riorientare il Servizio Sanitario Nazionale (SSN) per migliorarne l'efficacia nel rispondere ai bisogni di cura delle persone, per rendere le strutture più moderne, digitali e inclusive, garantire equità di accesso alle cure, rafforzare la prevenzione e i servizi sul territorio promuovendo la ricerca, ed è articolata in due Componenti:
- Componente 1: Reti di prossimità, strutture intermedie e telemedicina per l'assistenza territoriale; 
- Componente 2: Innovazione, ricerca e digitalizzazione del Servizio Sanitario Nazionale",99bdc9fdd8097f067f77cb220074b1b5,25,"La Missione 6 Salute vuole migliorare e riorientare il Servizio Sanitario Nazionale (SSN) per promuovere la ricerca. Si concentra su due parti: - Organizzazione tra ospedali e case ambulatoriali per la cura dei pazienti - Coordinare i sistemi per garantire che le cure si siano adatte alle esigenze delle persone. - Assicurare che siano più moderne, digitali e accessibili per le persone, migliorare la prevenzione e la prevenzione nelle strutture del paese. - Infine, anche con un'innovazione e digitalizzazione del Servizio Sanitario Nazionale - Coordinare la ricerca e l'innovazione dell'assistenza."
